标题,作者,时间,内容,文章链接
男子交友陷入裸聊诈骗陷阱 警方顺藤摸瓜揪出洗钱团伙,信息新报,"
2022-04-25 08:56:42",经过四个多月的努力，近期，南京六合警方成功捣毁了一个为境外诈骗集团非法洗钱的犯罪团伙。而这起案件的线索，还要从2021年12月中旬，南京市民李先生的一次报警说起。2021年12月17日一早，李先生报警称，自己被人威胁敲诈了一万元。事情的起因是李先生下载了某交友软件，随后有名女子添加他为好友，聊了不多久，就添加了李先生的QQ，随后就视频和李先生进行了裸聊。裸聊后，对方立马变了脸，以裸聊截图为由，让李,https://www.163.com/dy/article/H5PNTC6C0552ADWT.html
砀山：走村入户宣传预防养老诈骗违法犯罪,信息新报,"
2022-04-26 20:58:17",为扎实推进打击整治养老诈骗专项行动，预防或减少以养老为名侵害老年人合法权益的各类诈骗犯罪，切实守护好老百姓的“养老钱”。4月25日，砀山县公安局薛楼派出所民警进村入户开展预防养老诈骗宣传活动，揭露养老诈骗的常见手段，提醒农村留守老年人增强防骗意识。（张广星 记者 江新年）,https://www.163.com/dy/article/H5TJJC6H0552ADWT.html
诈骗又有新花样！看似购物平台 实则赌博网站,宾县公安,"
2022-04-26 13:48:22",“充值就可以参与竞猜，稳赚不赔！”“这局猜‘卧虎’，保证赢。”微信群里，此起彼伏的呼喊声下，“赌博大神”正在“指导”客户们定向下注，殊不知客户以为赢是凭运气，实则是更大的“陷阱”。2022年2月25日，江苏省江阴市人民检察院以诈骗罪对宋某兵、宋某阳等3名被告人提起公诉，其余8名犯罪嫌疑人目前仍在进一步审查起诉中。漫画：高岳检察官提醒，网络赌博是违法犯罪行为，相比传统赌博来说网络赌博隐蔽性更高、迷惑,https://www.163.com/dy/article/H5SR04S30534N6BQ.html
名为恋爱实为诈骗 网络交友需谨慎,正义网新闻,"
2022-04-26 17:11:22","正义网桂林4月26日电(通讯员林霞 全珮灵)男子玩游戏时邂逅“完美女友”,却掉入诈骗陷阱,网络交友需谨慎,避免冲动保持理智。4月21日,广西壮族自治区恭城县法院以诈骗罪一审判处梁某有期徒刑三年,并处罚金1万元.某天,何某在玩游戏时结识了同队的一名队友,两人相谈甚欢,游戏结束后便互相交换了联系方式。交流数日,何某得知对方名叫梁某,长相标致且事业有成,不仅经营着一家酒庄,名下还有一家地产公司,两人感情",https://www.163.com/dy/article/H5T6JS4U05346982.html
骗子无孔不入，你能识别出网络诈骗吗,四川本地,"
2022-04-26 11:42:16",近段时间以来，网络诈骗相关话题频频登上热搜，很多人都发现，这些受骗者往往都对骗子深信不疑，且并不是没有生活经验的未成年或者容易上当受骗的老人。前几日，有新闻报道称一女子把自己关在车里给骗子转账。而近日，据相关消息，陕西榆林，硕士小帅（化名）接到自称“京东客服”的电话，对方称其不及时注销京东金条会影响征信。小帅按照对方要求操作，下载App开启共享屏幕功能，随后对方以注销不良记录额度为由，引诱小帅贷款,https://www.163.com/dy/article/H5SJP7IV0552M4FF.html
在微信朋友圈发布虚假信息实施诈骗属电信网络诈骗,法律读库,"
2022-04-23 08:31:52",裁判要旨最高人民法院、最高人民检察院《关于办理诈骗刑事案件具体应用法律若干问题的解释》（以下简称《解释》）第2条关于“对不特定的多数人实施诈骗”的规定，不是对诈骗行为人虚假陈述时犯罪对象数量特定化与否的刚性限定。在微信朋友圈发布虚假信息实施诈骗，具备电信网络诈骗的行为特征，属于电信网络诈骗。案 情被告人吴某利用国家处在全力预防和控制新型冠状病毒感染月市炎疫情期间口罩等防控物资奇缺的特殊情境，在微信,https://www.163.com/dy/article/H5KHMFGP0521BN7Q.html
电诈骗局要当心 防骗要诀请牢记,江淮晨报,"
2022-04-25 06:48:27",混入幼儿园QQ群冒充老师，向家长“收取”服装费；PS虚假“不雅照”，以此要挟受害人支付钱财……近日，合肥市组织召开全市打击治理电信网络新型违法犯罪工作电视电话会议，通报了全市打击电信诈骗违法犯罪取得的成效以及几起典型案例。去年，全市破获电信网络诈骗现行案件1938起，较2020年同期上升了60.30%；打击处理电诈嫌疑人数较2020年同期上升18.56%，全市电诈警情同比下降5.4%。2022年一,https://www.163.com/dy/article/H5PGIH7I0550JTL4.html
这些都是诈骗！请速转父母,掌中孝感,"
2022-04-26 23:08:44",全国打击整治养老诈骗专项行动办公室在全国开展为期半年的打击整治养老诈骗专项行动养老诈骗常见套路都有哪些？一起来了解一下01提供虚假养老服务02投资虚假养老项目03销售虚假养老产品04虚假宣称以房养老05虚假代办养老保险06开展虚假养老帮扶再小也要当大事！提醒大家常回家看看讲讲防骗知识让不法分子“不敢骗、不能骗、骗不了”THE END,https://www.163.com/dy/article/H5TR284C0517RT6I.html
5名男子网上冒充美女诈骗！张店警方：抓！,大众日报,"
2022-04-26 17:01:25",4月20日，淄博张店一写字楼内，民警破门而入，只见十几平方米的空间内，摆放着十几套桌椅、电脑等办公设备，办公桌上杂乱无章地摆放着手机、无线网卡等物品，5名男子正坐在电脑面前忙碌地工作。谁能想到，这5名男子在网络上的身份竟是漂亮又温柔的“美女”。今年4月份，有群众报警称，在网上认识了一位“白富美”，加微信之后，这位“白富美”引诱其在“HSYK”投资平台进行投资后实施诈骗。接警后，淄博市公安局张店分局,https://www.163.com/dy/article/H5T61KLU0530WJTO.html
雅安公布打击整治养老诈骗线索举报方式！,雅安在线,"
2022-04-26 10:18:11",来源：雅安警方雅安市打击整治养老诈骗专项行动办公室关于公布打击整治养老诈骗专项行动线索举报方式的公告根据党中央决策部署，在全国开展为期半年打击整治养老诈骗专项行动。为依法严惩养老诈骗违法犯罪，着力整治规范以“养老”为名的涉诈问题隐患，坚决铲除养老诈骗违法犯罪滋生土壤，确保全市打击整治养老诈骗工作取得实效，现向社会公布举报方式。一、举报须知举报受理内容为涉及养老诈骗方面的线索。如举报其他方面的问题，,https://www.163.com/dy/article/H5SEVA6M0545GCF2.html
最高检部署推进打击整治养老诈骗专项行动,看西安,"
2022-04-26 20:07:19",近日，平安中国建设协调小组在全国部署开展打击整治养老诈骗专项行动后，最高人民检察院迅速作出部署，印发全国检察机关打击整治养老诈骗专项行动实施方案，要求各级检察机关全面贯彻习近平法治思想，以高度的政治自觉、法治自觉、检察自觉依法能动履职，积极推进打击整治养老诈骗专项行动。实施方案指出，要抓好宣传发动工作，畅通举报渠道，加强宣传教育。利用12309平台广泛接受群众举报线索，依法办理。发现应当立案而不立,https://www.163.com/dy/article/H5TGM1700525SRQD.html
【预警】谨防网上投资、赌博类诈骗！,娱乐防护栏,"
2022-04-26 09:44:10",如今大家生活好了手里都或多或少有点儿闲钱了就开始想着怎么能让钱生更多的钱这也使得各种投资市场都火爆异常毕竟谁也不想错过赚钱的机会也正因为如此最爱蹭热点的骗子们又暗戳戳上线了他们利用人们对赚钱的渴望打着网络投资的旗号实施诈骗不少人都着了他们的道儿不仅没赚到钱还被骗得倾家荡产来源：网络诈骗终结者,https://www.163.com/dy/article/H5SD0V5K0517NDRU.html
生活与法｜微信“亲属卡”成诈骗新工具,齐鲁壹点,"
2022-04-26 09:58:58",不少人将微信“亲属卡”赠送给父母、子女作消费使用。然而，这也让骗子有了可乘之机。近日，陕西西安的冯女士发现自己的微信登录异常，找同事帮忙验证重新登录进去后，却发现微信账号被人送出了4张“亲属卡”，导致微信钱包损失12000元。故事微信被盗后损失1.2万元“我很多朋友在延安，平时联系少，微信被盗后，有位朋友联系我说，他3月29日一大早就收到我发的微信，说是我家人生病住院了急需用钱，但我微信被限制提现,https://www.163.com/dy/article/H5SDS3JA0530WJIN.html
武宁县豫宁街道开展“防范电信诈骗”主题宣传,金台资讯,"
2022-04-26 18:04:32",编者按： 4月26日，武宁县豫宁街道白石岭社区组织居民开展“防范电信诈骗”主题宣传活动，进一步开展防范电信诈骗宣传活动，增强群众的防范意识。 活动现场，白石岭社区法律明白人、网格员通过派发反诈宣传单、咨询、答疑的方式，向居民介绍当前电信诈骗犯罪的常用手段和作案方式。新时代文明实践站志愿者认真为老年人普及防诈反诈常识，并教他们安装使用国家反诈中心APP，做到碰到诈骗时做到未知链接不点击、陌生来电不轻,https://www.163.com/dy/article/H5T9L6FR05346936.html
广西公布打击整治养老诈骗线索举报方式！,南宁警方,"
2022-04-26 13:24:15",为广泛接收群众举报线索，依法维护老年人合法权益，中央政法委在12337智能化举报平台开通“养老诈骗”举报通道，用户通过扫描二维码，即可登录12337智能化举报平台反映问题。举报人应本着实事求是的原则，如实反映问题。广西打击整治养老诈骗线索举报专用信箱：广西壮族自治区南宁市A058号邮政信箱自治区打击整治养老诈骗专项行动办公室2022年4月22日（来源：南天一剑）,https://www.163.com/dy/article/H5SPK05T05341C4X.html
沧州渤海新区：筑牢防范电信诈骗“防火墙”,举报,"
2022-04-26 17:28:03",近期，沧州渤海新区骅港海防派出所组织民警到社区、黄骅港码头，面对面向靠岸居民、船员宣传电信网络诈骗违法犯罪防范工作，引导帮助他们下载国家反诈中心App，详细讲解反诈防范措施。让群众认识到防范电信诈骗的重要性，筑牢防范电信诈骗的“防火墙”。(陈茵 傅新春)StartFragmentEndFragment,https://hebei.news.163.com/22/0426/17/H5T7ID4F0415987E.html
化州下郭、东山竟是网络诈骗高发地? 诈骗手段曝光！,化州社区,"
2022-04-18 10:53:30",茂名电信网络诈骗发案情况周报2021年4月4日至4月10日发案态势高发街镇高发手法本周，高发诈骗手法依次为：刷单返利类诈骗、冒充公检法类诈骗、冒充电商物流客服类诈骗、虚假贷款类诈骗、虚假购物服务类诈骗、虚假征信类诈骗、网络游戏装备类诈骗、杀猪盘类。典型案件案例一【冒充公检法类诈骗】2022年4月3日，滨海某事主报警，称其于2022年3月26日下午接到电话，对方自称是茂名市公安局民警，说事主的身份信,https://www.163.com/dy/article/H57TQ7FQ0537036W.html
杭州律师：区分一般诈骗与电信网络诈骗是重要辩护点, , , ,https://www.163.com/v/video/VI4TFKFHE.html
电信网络诈骗十大典型案例（10）︱“杀猪盘”诈骗案,常州市中级人民法院,"
2022-04-24 17:26:08",骗子自述我今年33岁，初中毕业，我在郑州找工作时，在网上看到一种利用虚假恋爱关系，以互赠、索要礼物为由，骗得对方财物的方法，我觉得这是个赚钱的路子，自己也动了这个念头。我在某广场用我老婆的身份开了家微店叫“鑫鑫优购”，招揽了部分员工，我对他们进行了培训。具体操作方法是员工自己申请多个微信号，在陌陌和微信上利用女性头像去搜索男性目标客户，地点没有限制，感觉聊到一块，形成了虚假恋爱关系，就开始互相发礼,https://www.163.com/dy/article/H5O2LEMJ0514C4R7.html
农贸集市上扫码送塑料凳？这是诈骗！济南警方抓获10余名“引流”诈骗嫌疑人,齐鲁网,"
2022-04-22 19:55:02",农村集市上扫码就送塑料凳2月27日恰逢济南市长清区孝里街道办事处农贸市集，蒋阿姨跟往常一样去赶集买菜，没被新鲜的蔬菜吸引，却为两个在集市上吆喝的青年停下了脚步，搭耳一听扫码入群有礼物、仔细一看礼品脸盆质量还不赖，蒋阿姨就主动将手机递给那个“嘴皮子溜圆”的小伙子，在他的一顿操作下，蒋阿姨就入了所谓的微信群，就在蒋阿姨兴高采烈地挑选自己中意的脸盆时，两个“推销的”青年竟将几条广告悄悄地转发到了蒋阿姨其,https://www.163.com/dy/article/H5J6CLP40514CFC7.html
工人派出所开展预防电信诈骗宣传活动,举报,"
2022-04-25 13:22:45",为切实做好防范电信诈骗工作，近日，平山公安分局工人派出所组织民警深入辖区广泛开展防范电信诈骗宣传活动，有效打击诈骗犯罪、维护群众利益、预防和减少电信诈骗案件的发生。活动中，工人派出所社区民警走上街头，通过发放防范电信诈骗宣传资料，现场面对面讲解的形式宣传电信诈骗惯用的手法、作案方式以及识别、防范的技巧。现场指导群众关注“国家反诈中心政务号”，下载“国家反诈APP”，提醒群众不要轻易透露个人信息、不,https://liaoning.news.163.com/22/0425/13/H5Q74HHU04229BRS.html
滁州琅琊警方破获一起诈骗案,信息新报,"
2022-04-25 13:29:35","2月10日,家住滁州琅琊区的居民左某某突然接到刚从监狱释放的朋友刘某电话，称和他一起在狱中服刑的左某某的男友梁某某在狱中情绪不佳，想要调换监区，希望家人能帮忙“活动活动”。左某某闻讯心急如焚，刘某随即声称自己与监狱里的狱警很熟,只要家属愿意花钱，就能帮忙办成此事。随后，刘某虚构请狱警吃饭、送礼等理由向左某某索款1万多元。左某某待到与狱中男友视频会见时才发现被骗，于是报警。3月中旬,经过缜密侦查，滁",https://www.163.com/dy/article/H5Q7H1SM0552ADWT.html
诈骗87万余元！警惕这个“黑盒子”……,天津滨海新区法院,"
2022-04-24 23:06:32",您好，我是XX工作人员，现需要您将学生账户升级为成人账户，否则将影响您的征信……你好，我是XX客服，你前期在某宝上购买的衣服，很多买家反映质量较差，我们可以给你做退款理赔……相信不少人曾经接到过这类诈骗电话让人奇怪的是接电话的时候明明显示是本地号码骗子却人在外地甚至境外那么问题来了Tips近日滨海新区法院案情简介 被告人曹某纠集被告人康某通过“蝙蝠”软件勾结实施电信网络诈骗的上线人员，二被告人为逃,https://www.163.com/dy/article/H5OM4OGU0514QH3C.html
刷单就是诈骗！,信息新报,"
2022-04-26 13:20:32", 近日，浦江县公安局白马派出所接到一位应届女大学生金女士的报警，称其在网上刷单，18个小时之内被骗了79100元。 原来，在此前，金女士受邀请进了一个红包群，群主在群内推荐了某款社交APP，称该软件是采用“公益助力”的模式帮明星投票，可以轻松得到高额的刷单返利。 紧接着，一位自称是“数据员”的群成员添加了金女士好友，并将其拉进了一个“GGG优质数据操作单”群，随后告知了金女士具体的刷单模式和刷单金,https://www.163.com/dy/article/H5SPD61T0552ADWT.html
大田又有人中招！刷单就是诈骗！,大田县人民检察院,"
2022-04-22 19:04:17",零成本、低门槛、高回报……想想真的是“一本万利”的买卖~本来只想兼职挣钱、轻松获利可结果自己失去了更多…… 视频来源：永安市委政法委、永安市公安局近期我市各地发生多起网络刷单诈骗案件请广大市民提高警惕不听 不信 不转帐大田县 2起三元区 1起沙县区 1起 泰宁县 1起宁化县 2起面对诈骗我们要练就一双慧眼识破诈骗套路护好自己的钱袋子下面这些反诈小知识请收藏！高发电信网络诈骗类型0102030405,https://www.163.com/dy/article/H5J3FNU90512E4U8.html
转让门店反被说诈骗？如何处理？, , , ,https://www.163.com/v/video/VU4SETGNR.html
【网警提醒】警惕! 涉疫诈骗新套路！,覃塘宣传,"
2022-04-23 20:48:42",疫情防控不松懈谨防涉疫诈骗新套路当前，疫情防控形势严峻，各省市都出台严防严控疫情的管理措施和规定，在大家积极响应政府”防疫“号召，支持和配合政府疫情防控工作时，一些不法诈骗分子也趁机利用广大市民疫情防控”心理“，套用一些所谓的“官方消息”实施各种套路的诈骗，各种电信网络诈骗层出不穷，让人防不胜防。近日，平南网警就收到了群众举报称遇到了新型的涉疫诈骗，希望发布出 来，让大家进一步提高警惕。小伙伴们快,https://www.163.com/dy/article/H5LRRKP30514W2B7.html
检察官@你，远离新型刷单返利类诈骗陷阱,锦江检察,"
2022-04-25 19:54:43",对你嘘寒问暖、甜言蜜语当你把Ta当“真爱”他又告诉你“刷单＋网络赌博”能轻松赚大钱你以为从此走向人生巅峰殊不知已掉进新型刷单返利类诈骗陷阱案情回顾2019年5月至9月，被告人王某某前往境外加入一家诈骗犯罪集团。该诈骗犯罪集团通过虚设的赌博网络平台，以公司化运营对国内不特定对象实施网络诈骗活动。来源：重庆市检察院微信公众号重庆市检察院第五分院微信公众号重庆市九龙坡区检察院微信公众号编辑：吴鹏瑶来源：,https://www.163.com/dy/article/H5QTI85E0514M975.html
如何防范这些诈骗行为？请转给身边的人，谨防被骗！,今点黄州,"
2022-04-25 17:53:00",近期有不法分子 冒充疫情防控人员身穿“大白”防护服以登门采集核酸为由实施诈骗。希望大家保持警惕谨防落入陷阱！疫情期间有不法分子冒充「权威部门机构」，将钓鱼短信包装成各类防疫提示。提醒：无论何种名义，最终皆为获利，守好银行卡密，可疑链接警惕！不法分子伪装成「疫苗接种普查调查员」或「回访员」，以社区工作人员的名义让市民添加微信好友，再将市民拉入微信群。然后，不法分子在群内发布刷单、赌博等违法违规信息，,https://www.163.com/dy/article/H5QMJBTQ0514TBAN.html
最早的电信诈骗, , , ,https://www.163.com/v/video/VM51BVKVS.html
借车抵押实为诈骗 双辽法院“云”法庭宣判一起诈骗案件,中国吉林网,"
2022-04-24 17:34:28",近日，双辽市人民法院通过远程提讯“云”庭审，公开宣判一起诈骗案件，以诈骗罪判处被告人辛某华有期徒刑三年六个月，并处罚金人民币四万元。公诉人、被告人律师现场就座，被告人在看守所通过远程视频系统开庭。经审理查明，2021年4月，被告人辛某华在欠有大量外债无法偿还的情况下，将自己在长春租赁公司租的一台2014款奥迪A6车抵押在刘某处，谎称该车系自己所有，向刘某抵押借款60000元，刘某实际交给辛某华57,https://www.163.com/dy/article/H5O34MUC05149AGP.html
反电信网络诈骗丨远离“刷单”诈骗,遵义交旅投,"
2022-04-14 17:39:19",遵义公安反诈防范宣传（2022）第2期电信诈骗之王——刷单诈骗刷单诈骗为什么被称为诈骗之王？因为它：发案最高！金额最大！形式多变！2022年1月1日以来，遵义市电信网络诈骗案件分布如下：那么，到底什么是刷单诈骗？刷单诈骗全称为刷单返利类诈骗，指犯罪嫌疑人通过QQ、微信、陌陌、短信、抖音、快手、网页、招聘平台等各类社交软件、移动互联网渠道发布刷单返利兼职广告，以“高佣金”回报为诱饵，诱导受害人下载或,https://www.163.com/dy/article/H4UBED96053873E7.html
【警惕】APP诈骗已成主要手段！国家网信办曝光6个电信网络诈骗典型案例！,汕头吃喝玩乐,"
2022-04-25 16:02:16",为贯彻落实习近平总书记关于打击治理电信网络诈骗犯罪工作的重要指示精神，切实保障人民群众财产安全，国家网信办会同公安部等有关部门，深入整治电信网络新型违法犯罪，建设国家涉诈黑样本库，建立互联网预警劝阻平台，精准提示潜在受害人，维护人民群众切身利益。今年以来，国家网信办反诈中心排查打击涉诈网址87.8万个、APP7.3万个、跨境电话7.5万个，并纳入国家涉诈黑样本库。目前，国家涉诈黑样本库已涵盖并处置,https://www.163.com/dy/article/H5QG8K1M0538B61U.html
警惕！诈骗黑手盯上网课小学生, , , ,https://www.163.com/v/video/VP4QE4GJA.html
四名男子伪装“援交女”诈骗, , , ,https://www.163.com/v/video/VS524B0T5.html
公安部部署开展打击整治养老诈骗专项行动,平安长寿,"
2022-04-23 01:22:05",全国公安机关打击整治养老诈骗专项行动部署会19日召开，部署各级公安机关依法严厉打击整治养老诈骗违法犯罪，切实维护老年人合法权益，以实际行动迎接党的二十大胜利召开。公安部要求，要以打开路、多措并举，迅速掀起打击整治工作高潮。要强化线索摸排，广泛发动群众，强化部门协同，及时发现核查处置养老诈骗违法犯罪线索。要以提供“养老服务”、投资“养老项目”、销售“养老产品”、宣称“以房养老”、代办“养老保险”、开,https://www.163.com/dy/article/H5JP3H280514RQN3.html
还被骗？ 真实案例！反诈骗中心教你如何防范网络诈骗！,微甘孜,"
2022-04-16 09:12:40",会议充分肯定了2021年全州打击治理电信网络诈骗新型违法犯罪工作取得的成效。●三是宣传防范全面延伸。联席办各成员单位积极开展防范电信网络诈骗宣传工作，全力营造“全民反诈”氛围，防范触角向全州域延伸，切实提升了群众防骗意识。会议强调，打击治理电信网络诈骗犯罪事关人民切身利益，事关社会大局稳定，事关经济金融安全，各县（市）、各部门要准确把握当前电信网络诈骗违法犯罪新形势、新变化，牢固树立以人民为中心的,https://www.163.com/dy/article/H52J84VD0514CC6P.html
女警察卧底电信诈骗窝点 ，身份险些遭到暴露, , , ,https://www.163.com/v/video/VO5180U5C.html
伪造存折吓坏市民 警方慧眼识破电诈骗局,襄阳汉江网,"
2022-04-25 15:23:36",不法分子为了成功实施电信诈骗犯罪能够做到什么程度？4月24日，记者在民警搜集的证据中，看到了以假乱真的伪造存折。这张存折中，除了开户时存入的100元外，其他进出流水最小金额都是10万元，最大金额单笔高达百万元，而且盖有红色印章，乍一看，完全分不出真假。也就是这样一张大额流水频繁的存折，差点骗了市民宋女士。4月21日下午，宋女士接到一名自称广州市人民检察院“检察官”的电话，对方说宋女士名下银行账户涉,https://www.163.com/dy/article/H5QE1P8G0514D58E.html
悬！女子被诈骗将自己锁在车里转账, , , ,https://www.163.com/v/video/VZ4UQB9QB.html
破除电信诈骗，得从清除“内鬼”开始,红网,"
2022-04-23 16:20:23",□沈宏胜公民个人信息是犯罪分子实施电信网络诈骗犯罪的“基础物料”，被泄露并被不法分子获取，后果不堪设想。一旦有行业“内鬼”非法获取个人信息并将其用于电诈，危害尤为严重。最高人民检察院21日公布的一起典型案例，揭露了“内鬼”的行为。（4月21日新华社）俗话说得好，“一粒老鼠屎打坏一锅汤”。本来是网络诈骗，却让电信背上了“电信诈骗”的包袱，不过，如果不是“内鬼”作祟，公民个人信息怎么能上了网，继而被骗,https://www.163.com/dy/article/H5LCGBNN0514EV7Q.html
反电诈 · 打击整治养老诈骗专项行动 | @所有老年人 这一份防诈骗指南请收好！,岢岚县妇联,"
2022-04-24 16:38:18",诈骗套路层出不穷而老年人的防范意识薄弱常常成为诈骗分子的“下手对象”作为老年人应当如何防诈骗呢？这一份防诈骗指南请收好！保健品诈骗老年人十分注重养生，诈骗分子借此诱惑老年人高价购买毫无用处的保健品，某些受疾病困扰的老年人会相信诈骗分子所说的各种“神奇”的偏方疗法。诈骗分子打着免费送鸡蛋、水果、小家电的幌子，租用专门场地向老年人宣传“保健产品”、“治疗药品”，夸大产品功效诱惑老年人，从而实施诈骗。防,https://www.163.com/dy/article/H5NVTS4J05346TWM.html
