标题,作者,时间,内容,文章链接
防范养老诈骗，警惕这些骗局正在洗劫老年人！,河池警事,"
2022-04-22 19:02:02",保健品骗局诈骗分子打着免费赠送鸡蛋、水果、小家电的幌子，专门租用场地向老年人宣传公司的“保健产品”和“治疗药品”，夸大产品的功效诱惑老年人从而实施诈骗。警方提醒老年人十分注重健康养生，于是骗子借此诱导老年人花天价购买毫无作用的保健品或药品。同时，也有一些因疾病困扰的老年人会特别“迷信”各种“神奇”的疗法，以求保长寿体健。殊不知，这样正好进入了不法分子设计的圈套。因此，面对保健品诈骗时，我们不要相信,https://www.163.com/dy/article/H5J3BKHA0514T107.html
骗子冒充单亲妈妈诈骗千万, , , ,https://www.163.com/v/video/VL4F8AAOL.html
单身蜘蛛真网恋，奔现发现是诈骗, , , ,https://www.163.com/v/video/VM4AOSLO9.html
养老诈骗知多少？防骗指南请收好,永安市人民检察院,"
2022-04-22 16:16:46",“保健品”诈骗、“投资理财”诈骗，“低价旅游”诈骗、“杀猪盘”诈骗……这些主要针对老年人群体的诈骗手段，看似各不相同，套路却有迹可寻，跟随小编一起揭秘诈骗套路，做个智慧老人。“保健品”骗局“保键品”诈骗往往瞄准老年人渴望健康的心理，前期通过各种手段了解老人的需求和身体健康状况，通过赠送米、面、鸡蛋等小礼品，陪伴聊天解闷等方式取得老年人的信任后，开始推荐产品，打着祛病强身、偏方有奇效等幌子夸大“保健,https://www.163.com/dy/article/H5IPT0QL0514E2SO.html
疫情年，警惕国外社交平台诈骗，莫随意翻墙,大油条先生,"
2022-04-23 03:44:38",前两期，我们重点给大家分享了年轻人在各类新型社交平台下的工作和情感状态。今天为最后一期，我们结合技术小组实际跟踪情况，来给大家讲解国外的社交平台上的诈骗套路。希望能给大家一个警惕。疫情年，很多区域都有过封控时段，很多人员群体也有被室内居家隔离的经历，再加上国外俄乌战争火热，很多人按奈不住好奇之心，尝试通过翻墙的形式了解国外的资讯。于是，诈骗风险也跟着开始。近年来，随着各级监管机构对电信诈骗的重视和,https://www.163.com/dy/article/H5K18FMN05421P5K.html
盘点那些智商感人的诈骗犯，诈骗电话全程录音，骗人不成反被坑惨, , , ,https://www.163.com/v/video/VP4K919GM.html
欠钱不还可能构成诈骗 什么情况下欠钱属于诈骗, , , ,https://www.163.com/v/video/VB4CQM918.html
着急的声音，只为人民群众不被诈骗, , , ,https://www.163.com/v/video/VB4KL2I5G.html
新型诈骗侵犯你？广东已成立“专业打猫队”！,南方Plus,"
2022-04-27 19:10:46",当前，电信网络诈骗案件日益呈现出团伙化、专业化、高科技化的特点，诈骗分子采用了人机分离、机卡分离、网络改号、移动作案、跨境作案等新型作案手段，南方+记者从广东省通信管理局获悉，针对此新变化，省通信管理局指导基础电信企业成立“专业打猫队”（“打猫”行动是指针对利用GOIP“一种虚拟拨号设备”、多卡宝等猫池设备进行电信网络违法犯罪的一系列专项治理工作和打击行动，以保障人民财产安全。），深入研究部署监测,https://www.163.com/dy/article/H5VVR6U7055004XG.html
安徽和县：揭露养老诈骗“套路”,信息新报,"
2022-04-22 10:45:14",4月21日，安徽省马鞍山市和县公安局民警正在向老年群众宣讲养老诈骗“套路”，帮助老年人提高法治意识和识骗防骗能力。近日，安徽省公安机关部署打击整治养老诈骗专项行动，重点惩处以养老为名侵害老年人合法权益的各类诈骗犯罪，切实维护好老年人合法权益。（秦祖泉）,https://www.163.com/dy/article/H5I6TV9K0552ADWT.html
【法关注】@金山人，这份《防范电信网络诈骗宣传手册》请查收......这48种常见电信网络诈骗方法，你信了吗？,上海市金山区司法局,"
2022-04-21 14:49:05",《防范电信网络诈骗宣传手册》“三不一多”原则电信网络诈骗手法千变万化，但万变不离其宗，记住“三不一多”原则：未知链接不点击陌生来电不轻信个人信息不透露转账汇款多核实宣传千万次，从不认真看。骗后急报警，天天催破案。骗子在境外，警察侦办难。破案要条件，防范是关键。源头被阻断，哪里有发案？信息多转发，人人来宣传。伎俩多知晓，防患于未然！最后，小编再次提醒大家接到陌生电话或短信要求转款一定谨慎对待，多方核,https://www.163.com/dy/article/H5G2FOE10534128P.html
民警抓捕诈骗嫌疑人, , , ,https://www.163.com/v/video/VY4HR1KQM.html
预警！冒充快递类诈骗卷土重来,汉新闻,"
2022-04-21 11:36:58",之前有冒充快递客服实施诈骗，如今又有冒充快递员实施诈骗。骗子们的诈骗手段可谓是花样百出，丝毫不给我们喘息的机会。最近这种新型快递类诈骗，来势凶猛。面对日益嚣张的诈骗分子，我们为大家送上一份防骗指南，及时帮助大家应对此类新型诈骗手段，提高警惕、加强防范，维护好广大群众的财产安全。1、诈骗分子谎称“快递检出新冠阳性需销毁赔付”实施诈骗某地，吴先生接到自称某快递公司的电话，说他的快递在运输过程中被检出新,https://www.163.com/dy/article/H5FNFTS90530Q6HV.html
冒充公检法诈骗手法揭秘, , , ,https://www.163.com/v/video/VV4QM73C8.html
7人被抓！榆林严打诈骗犯罪,榆林最新信息,"
2022-04-23 13:22:34", 免费 公众号『榆林最新信息』发布查询近年来，公安榆阳分局针对传统诈骗犯罪，以对人民群众高度负责的使命担当，集中力量展开破案攻坚和追赃挽损，刑警大队按照“雷霆2022”专项行动的部署要求，以创建“藏蓝服务、情暖刑警”一流品牌为目标，以打击整治的实际成效不断提升人民群众的幸福感、获得感和安全感。典型案例01案例1月11日，刑警大队抓获涉嫌诈骗犯罪嫌疑人王某。经查，2019年以来，王某谎称本人及亲戚有,https://www.163.com/dy/article/H5L2AONM0538N2MQ.html
这真不是诈骗短信！广州疾控最新提醒,番禺台,"
2022-04-22 22:41:37",广州疾控提醒：这种短信还真不是诈骗短信之前一些市民朋友收到这样的短信相信有相当一部分的市民心里会咯噔一下这又来诈骗短信？！据广州疾控部门消息这并非诈骗短信据了解，这是为了尽快在短时间内告知相关重点人群并进行调查，尽快对相关人群进行健康管理。这也是流调人员为尽快获取流调信息采用的方法之一。之后，流调人员会根据工作的需要，安排继续使用这种方式提速流调工作。所以如果您收到这样的短信请点开链接进行填写大家,https://www.163.com/dy/article/H5JFTMQK0530RJ4L.html
严厉打击整治“养老诈骗”，请扫码举报！,掌中鞍山,"
2022-04-20 19:44:12",为广泛接收群众举报线索，严厉打击假借养老之名实施诈骗、骗取公私财物的违法犯罪行为，依法维护老年人合法权益，中央政法委在12337智能化举报平台开通“养老诈骗”举报通道，用户通过扫描二维码即可登录12337智能化举报平台反映问题。举报人应本着实事求是的原则，如实反映问题。利用举报捏造事实、诬告陷害的，将承担相应的法律责任。（来源：鞍山全媒）图文编辑：高 超 张文一 兰 多交流邮箱：astdkb@16,https://www.163.com/dy/article/H5E0VCNP0524RTOS.html
警花小姐姐“硬核”喊话 带你远离电信诈骗, , , ,https://www.163.com/v/video/VV50J82ME.html
注意！电信诈骗类型已超50种 这种诈骗方式占六成,环球网资讯,"
2022-04-14 13:19:42",中新财经4月14日电 (吴涛 邵婉云)“电信诈骗类型现在已经超过50种”“一年破获电信网络诈骗案件39.4万起，抓获犯罪嫌疑人63.4万名”“清理高危电话卡7769万张”。14日，在国新办举行的新闻发布会上，公安部等部门公布了打击治理电信网络诈骗犯罪工作进展情况。电信网络诈骗立案数连续9个月同比下降电信网络诈骗犯罪近年来持续上升的势头得到有效遏制，去年6月至今实现立案数连续9个月同比下降。公安部会,https://www.163.com/dy/article/H4TSJ1HS0514R9OJ.html
净网2022诈骗达到多少金额可以定罪？, , , ,https://www.163.com/v/video/VW4IKHGOL.html
巨额来电：电话诈骗，假装是警察，让你转账, , , ,https://www.163.com/v/video/VN4K8S9MI.html
盘点搞笑诈骗电话冥场面：三岁宝宝接到诈骗电话，骗子内心崩溃了, , , ,https://www.163.com/v/video/VS438AODO.html
转扩！养老诈骗常见套路都有哪些？快让父母看看,绝对现场,"
2022-04-27 20:14:47",或许因为工作忙、疫情等原因我们少有时间陪伴在老人身边想一想你有多久没有好好与他们沟通了？他们也需要关怀就像你小时候一样因为缺乏陪伴关爱许多老年人很容易上当受骗下图是涉及养老诈骗的常用套路快快转发父母看看！许多老年人过着“出门一把锁，进门一盏灯”的寂寞生活他们充满了对亲情的渴望然而“雪中送炭”的不是子女却是诈骗分子这让他们的防线被轻易攻破请多关爱他们常回家看看哪怕是说说家常讲讲防骗知识来源：大庆政法,https://www.163.com/dy/article/H603GEMH0530J7VL.html
以为警察上门抓自己受诈骗女子当场崩溃, , , ,https://www.163.com/v/video/VY4IC0EAK.html
【防范电信诈骗】“关爱老人，预防诈骗” 一组漫画送给你！,黑河文旅,"
2022-04-27 21:35:53",经典案例分享来源：黑河市打击整治养老诈骗专项行动综合组一审：沈莹莹二审：白 云,https://www.163.com/dy/article/H6084U4O0514OPGR.html
冒充“军人”订餐诈骗 云南民警及时劝阻止损,云南网,"
2022-04-22 22:32:13",民警帮助黄女士安装“国家反诈中心App”。供图云南网讯（记者 谢进 通讯员 牛毓菁 严自高）如果有人自称“军人”找你订餐，你会不会觉得天降“大生意”？千万当心！有可能你已经落入骗子的圈套。近日，勐海县勐满镇的黄女士遭遇冒充“军人”订餐，勐满边境派出所民警及时劝阻止损，成功阻止一起电信诈骗案，保障了人民群众的财产安全。据了解，自营餐馆生意的黄女士于近日接到一个自称是“部队领导”的陌生电话，称其部队进,https://www.163.com/dy/article/H5JFCG200514R9NO.html
防范养老诈骗，守护老年人钱袋子,信息新报,"
2022-04-27 16:54:36", 近日，西固区临洮街街道清水街社区在做好疫情防控的同时，积极开展“防疫+养老反诈”宣传活动，实现了疫情防控与反养老诈骗宣传齐步走、同推进，推动养老反诈工作向纵深落实，增强辖区居民防范养老诈骗“免疫力”。 社区利用悬挂横幅、线上问卷调查、短视频等宣传方式，通过线上短视频方式讲解非法集资的特征、表现形式和常见手段，使老年人及其家人有效识别养老服务领域非法集资诈骗行为，增强老年人防范意识。 今后社区将建,https://www.163.com/dy/article/H5VO255T0552ADWT.html
 太可恶！这些诈骗，专挑老年人下手,举报,"
2022-04-22 21:49:07",编者按StartFragment来源：最高人民检察院编辑：姚春燕EndFragment,https://shanxi.news.163.com/22/0422/21/H5JCTI12041999R7.html
公安部 开展打击整治“养老诈骗”专项行动, , , ,https://www.163.com/v/video/VY4KJGK5B.html
反诈警官老陈辟谣“后悔辞职”！晒聊天记录，自言要到中宣部举报,裕丰娱间说,"
2022-04-24 01:53:25",反诈警官老陈爆红之后，就引来了很多网友的质疑，有人认为老陈作为警官不应该出现在网络中，这会损害名声，也有人认为老陈紧跟时代潮流，运用网络宣传诈骗，不仅可以起到事半功倍的效果，也能在线震慑那些诈骗犯。如果按照这条路走下去，那么老陈必然会在反诈的历史留下浓重的一笔。可惜的是，他先后遭到网友质疑，声称伴随时间的推移，以及打赏金额的增加，他的眼里没有了光，这句话深深戳中了老陈的内心，为了自己的公益梦想，为,https://www.163.com/dy/article/H5MD9I320537B1I5.html
被打赏100万后辞职，反诈警官老陈后悔了？,雷科技,"
2022-04-24 22:10:02",如今提到“反诈骗”，小伙伴们脑海里会想到什么东西？是那些在线下奔波一整天，给我们宣传反诈知识的民警，还是新闻上经常播报“富婆被骗上百万元”的典型案例呢？如果你问小雷，我一定会说出那个让无数诈骗分子直冒冷汗的【国家反诈中心】。当时它以迅雷不及掩耳之势冲上App Store下载榜第一。也许钉钉和微信怎么都想不到，一个冷门的反诈App，会崛起得如此之快。至于国家反诈中心App怎么火起来的，相信各位冲浪高,https://www.163.com/dy/article/H5O8B7GP051100B9.html
反诈老陈失算了！论坚守比不上谭警官，论聪明比不上大衣哥,娱乐八卦大大,"
2022-04-27 03:14:52",最近有消息称，因在短视频平台上做反诈宣传，而一夜爆火的陈警官，在辞去警察工作后，直播热度迅速凉凉。脱下穿了16年的警服，重新变成普通人的老陈，开始表示自己有些后悔了！一夜成名“您好，我是反诈主播，请问你是什么主播？”可想而知，当那些靠着性别反串、各种搞怪、低俗擦边的娱乐主播们，突然连麦上一位身穿制服的在职警察，并看他一脸严肃地做完这样的自我介绍后，会是一种什么样的心情。一恍惚直播间好像突然就变成了,https://www.163.com/dy/article/H5U94PI30529LJQL.html
仿冒平台、借疫诈骗……诈骗高发态势下，金科反诈有哪些硬核举措？,北京商报,"
2022-04-25 21:30:05","假网贷诈骗、""杀猪盘""""以房养老""、注销校园贷……这些诈骗手法你都听过吗？近期，各类电信诈骗高发，也引起金融科技公司的警惕。4月25日，北京商报记者多方采访了解到，包括蚂蚁集团、美团、度小满、360数科、同盾科技、乐信、信也科技、萨摩耶云、百融云创、融360等在内的十余家金融科技公司都在升级反诈手段，通过诈骗识别及拦截、联动警方、反诈宣传等多样举措，全面围堵。仿冒平台、蹭热点花样不断翻新各类五花八",https://www.163.com/dy/article/H5R30S980519DFFO.html
“反诈警官老陈”辞职：我做了一个错误的决定,中国新闻周刊,"
2022-04-23 09:19:54",本刊记者/倪伟发于2022.4.25总第1041期《中国新闻周刊》直播间里，蹦出一个金色奖杯状的礼物，在主播老陈面前旋转，伴随着闪烁的光晕。接着是第二个、第三个……一口气刷了333个。老陈语无伦次了，结结巴巴地说：“这是全国、今天最大的、一个那啥吧。”这个礼物叫“嘉年华”，抖音直播间里最贵的礼物，每个得用3000元人民币购买。当晚收到的“嘉年华”共计100万元。他照例分文未取，尽数捐给了慈善机构，,https://www.163.com/dy/article/H5KKECHC0514BE2Q.html
后悔了？“反诈老陈”辞职15天后，称自己做了错误的决定,娱乐星使,"
2022-04-23 11:05:09",前段时间，“反诈老陈”辞职一事，持续引发网友关注。“反诈老陈”本名陈国平，是秦皇岛市公安局海港分局的一名警察。因为跟网络主播连麦宣传国家反诈中心APP，闹出许多笑话而走红。老陈辞职跟他收到百万打赏一事有关，他自称不想连累自己的单位，所以才辞职的。从“反诈老陈”宣布辞职到到现在，才过去15天时间。在这15天里，“反诈老陈”原来的账号名改回“海港反诈中心”，这也意味着老陈和这个账号再无瓜葛。老陈自己的,https://www.163.com/dy/article/H5KQF39V0552C39B.html
反诈老陈后悔辞职：网暴有错，但你也不无辜，名利面前见人性！,虎牙妹,"
2022-04-25 00:10:24",老陈被网暴了吗？是的，老陈火了之后飘了吗？有点，走到今天这个地步，老陈算不算“活该”呢？答案是肯定的。说实话，老陈的临场反应和说话节奏并不适合直播，既没有谭sir的幽默，也没有明确的个人特色，那么，老陈为什么就火起来了呢？老陈在网络上的异军突起，是因为网友关心反诈吗？当然不是，诈骗这种事情，绝大部分人都会认为离自己很远很远。这就是反诈的娱乐化，只要接了地气，就能吸引一大票粉丝，这正是他成功，或者说,https://www.163.com/dy/article/H5OPPKAU05527RTZ.html
“反诈老陈”辞职了，诈骗分子高兴了，老百姓要绷紧弦了,重剑藏锋,"
2022-04-26 20:42:22",其实老陈他作为一个警察，一开始没想到会走到这一步。他一开始的直播，肯定也是受到大家的支持和欢迎的，但是随这一笔将近100万的这样的一个赞赏，把他放在了舆论的顶尖上。不知道为什么会出现这样一个情况，是不是被人整进了一个坑，还是其他的一些什么原因。总之，这一笔巨额的赞赏，让他没办法，只有辞去警察这份工作，因为他说，作为国家公职人员，如果是因为这样影响到单位声誉，不好。反诈宣传，现在是各级公安机关工作的,https://www.163.com/dy/article/H5TIM3FS05535CG2.html
反诈警官老陈辞职：我做了一个错误的决定！他哪里错了？,小城故事君哥,"
2022-04-23 23:44:17",“反诈警官老陈”辞去了公职，换上了便装，个人直播账号也改名为“老陈生活号”。“其实这个决定是错误的！”陈国平说，“但我想，终究有人要来做一些错误的决定，给后人做个警示教育或者提供经验。”至于是哪方面的警示和经验，他没有解释。老陈真名叫陈国平，据他自己介绍，他从警已经十多年了，从2018年开始，他利用业余时间从事反电信网络诈骗宣传工作，一开始是在直播平台介绍电信诈骗的案例和讲解一些新型诈骗手法，因为,https://www.163.com/dy/article/H5M5T39Q0552Q5OT.html
别再上当啦！！！国家反诈中心APP装起来,信息新报,"
2022-04-26 13:30:30",为提升群众的识骗防骗能力与意识，预防和减少诈骗案件的发生，保障人民群众的财产安全，构建全民反诈新格局，近日，大滩社区开展了“防诈骗、反诈骗”宣传活动。活动现场，从“什么是电信诈骗”、“电信诈骗的常见形式”、“如何识别防范电信诈骗”等方面为居民科普了有关网络诈骗的知识，提醒群众在日常生活中要注意保护好个人信息，不要随意泄露身份信息、银行账户等个人信息，不要贪图小便宜，不要被虚假广告迷惑，做到不轻信、,https://www.163.com/dy/article/H5SPVDPD0552ADWT.html
“海南村霸”大漠叔叔，剧本演绎还是本色出演，为何反诈老陈不行, , , ,https://www.163.com/v/video/VQ51BCJHD.html
哈尔滨：一场反诈“赛跑”紧急止付400万元,新华社,"
2022-04-27 14:56:15",“止付成功！”消息传来，哈尔滨市公安局反诈中心一片欢呼。经过一场反诈民警与诈骗分子的“赛跑”，为群众挽回经济损失400万元。4月18日，哈尔滨市民常某接到了一个“00”开头的陌生电话，对方称自己是警察，查明常某涉嫌洗黑钱。常某为了自证清白，积极配合“办案”。与此同时，哈尔滨市公安局反诈中心预警员发现常某正在遭遇境外诈骗，立即拨打其电话，但电话一直处于“正在通话中”。哈尔滨市公安局反诈中心立即启动市,https://www.163.com/dy/article/H5VH962C05346RC6.html
“反诈民警”老陈辞去公职，以反诈主播身份继续“公益反诈”, , , ,https://www.163.com/v/video/VK3GQ6FUA.html
天上不会掉馅饼，大家一定要擦亮眼 反诈, , , ,https://www.163.com/v/video/VN4Q7A0M2.html
好家伙，狗子还会反诈呢, , , ,https://www.163.com/v/video/VE4QMRE5K.html
反诈民警老陈曝辞职决定的背后 , , , ,https://www.163.com/v/video/VH4VNNPCJ.html
“杀猪盘”电影要火 电影中的趣味反诈有多少？, , , ,https://www.163.com/v/video/VR5162UTG.html
反诈老陈质疑记者标题党 否认辞职决定是错误的, , , ,https://www.163.com/v/video/VG4Q37N35.html
曹操:真后悔没有下载反诈APP, , , ,https://www.163.com/v/video/VW4KN4263.html
反诈警官老陈称辞职是错误的决定,北青网-北京青年报,"
2022-04-23 11:59:05",【#反诈警官老陈称辞职是错误的决定#】4月8日，以“反诈警官老陈”账号风靡短视频平台的陈国平，在一条短视频中宣布辞职，他将辞职的原因归结为3月里的两次网暴事件。在这两次网暴里，他觉得看到了继续直播会牵连单位的苗头，毕竟他穿着警服，于是向单位提出了辞职。直播与单位以及本职工作之间的关系异常微妙，把控尺度非常困难，甚至是不可能的。“其实这个决定是错误的，”陈国平对@中国新闻周刊 说，“但我想终究有人要,https://www.163.com/dy/article/H5KTHSME0514R9KQ.html
【全民反诈】解封不解防，防疫更用心，反诈更精心！,环京津新闻网,"
2022-04-26 10:43:36",近期，我市因本轮疫情划定的中风险区域正逐步解封，但“解封”不等于“解防”，全市疫情防控形势仍然十分严峻。为了做好个人防护，共同捍卫来之不易的疫情防控成果，廊坊疾控建议市民从以下几个方面出发，继续做好个人防护：01科学戴口罩。戴口罩时要确保口罩紧密贴合并完全覆盖住口鼻和下巴。02勤洗手。在上厕所、触摸门把手或电梯按钮等公共设施之后，加工制作食品或饮食之前要洗手。03少聚集。做到保持距离不扎堆，人多场,https://www.163.com/dy/article/H5SGDR500550HLD8.html
“国家反诈中心”App你安装了吗？,金昌小城大事,"
2022-04-25 18:27:15",安装方法第一步：下载安装，在应用商城搜索“国家反诈中心”或扫描二维码安装第二步，注册认证第三步，开启预警防护功能请大家提醒身边的亲人赶快下载安装APP一起做反诈行动派！-END-编辑：金昌市公安局融媒体中心本土爆笑娱乐 八卦吐槽同城美食攻略 二手信息金昌新闻资讯 大事小情金 昌 最 具 人 气 的 公 众 号金昌小城大事在金昌 你可以不关注小城大事但你会跟你的小伙伴没得聊！合作电话：1539355,https://www.163.com/dy/article/H5QOI3J80545G8OW.html
反诈老陈后悔辞职？本人回应新一轮网暴：不后悔！, , , ,https://www.163.com/v/video/VS4QNMBJE.html
反诈民警接到诈骗电话，却被反问跟你有啥关系？骗子：把我删了吧, , , ,https://www.163.com/v/video/VI4V48LGC.html
神级反诈“话疗”！重庆小姐姐把骗子聊到要自首, , , ,https://www.163.com/v/video/VK51O47NU.html
6000万天价买域名？青岛反诈中心民警：99%是骗局,信网,"
2022-04-26 15:03:11",“国际大鳄”主动提出6000万收购域名近年来，域名这一新兴投资领域逐渐走进公众视野，一些短小精悍、简单易记的网络域名，具有一定的商业交易价值，高价收购域名的消息屡上头条，2011年，新浪微博的域名weibo.com的成交价达到800万元，2014年4月小米科技有限责任公司域名“mi.com”更是达到2243万元的交易额。这样的情况下，如果有人提出愿天价收购你持有的域名，相信很多人都会迅速沉浸于喜悦,https://www.163.com/dy/article/H5SV959S051482LC.html
《反诈民警图鉴》全民反诈 守护大家钱袋子, , , ,https://www.163.com/v/video/VY4VEGUF3.html
聊城市冠县全民反诈推进暨打击整治养老诈骗专项行动部署会议召开,大众网,"
2022-04-25 16:29:33",大众网·海报新闻记者 郑玉冰 聊城报道4月24日下午，冠县召开全民反诈推进暨打击整治养老诈骗专项行动部署会议，县委副书记张庆辉主持会议并讲话，县委常委、政法委书记张怀恒，副县长、县公安局局长李长峰，县法院院长王永前、县检察院检察长柴青云出席会议。会议采取视频形式召开，县直相关部门（单位）主要负责同志、分管负责同志，县公安局相关警种负责同志在主会场参加会议；各乡镇（街道）党政主要负责同志、分管副书记,https://www.163.com/dy/article/H5QHQI6Q0514R9KU.html
