,评论
179,一堆人在这装什么理中客，看了几个案子几个视频就可以出来说我们这些支持死刑的人不知民间疾苦？是弹幕法官？还是用正义”绑架“女孩家属的不理智份子?？？我可去你们的吧。你们知道真正的民间疾苦？？？对这个女孩家庭来说，父亲是为救人死亡，在孩子都还小的时候家里就早早就失去了顶梁柱，那个时候女孩1岁，男孩还在母亲腹中，女孩姐姐也不大，那个时候才是真正的苦，熬了这些年，大女儿出去工作分担压力，二女儿上了大学，受害女孩和弟弟也可以上学分担家务，这几年政策好，家里是建档立卡的也有不少照顾，对这个家来说，好生活才刚刚开始，根本不像你们想的那样。老说要为生者计，可正是为生者计，所以才更要判死！想一想死缓即使限制减刑，算上之前羁押时间，再过20年也就出来了，而那时候男孩也就30岁，娶妻，孩子应该也10岁左右了吧，那时候这恶魔又出现在附近，异地而处，就问你们怕不怕？？何况女孩家属是要判凶手死刑的，并没有谅解。对这个家庭来说，判处那恶人死刑就是最好的慰藉！
180,"冷静下来听完，纠结许久，夜不能寐，我仍然希望这个人被判死刑，立即执行。
一个如此懂事乖巧的小女孩就这么没了，凭什么他配活着？[无语]"
181,罗老师的视频都白看了？罗老师当初怎么说的？“法律要听从民众的意见，但要超越民众的偏见”
182,"冷静的人不应该嘲笑热血的人的愤怒，
但是热血的人就应该骂冷静的人冷血吗？
罗老师的视频是讲法律的，不是来让你们找个地方撕逼的好吗各位?"
183,"一审法院:管他呢，先从重判，申诉就不关我了
二审法院:这案子很麻烦啊，判轻点让家属申诉给最高法决定吧
最高法院:WDNMD[doge]"
184,"那个李昌奎案，我认为法官没什么错 因为真的有人学法，学着学着就丧失人性了，罗翔教授也讲过的。
眼中只有法律了，毕竟按照法律就是有两条从宽情节。"
185,刚刚看了结果，死刑立即执行。
186,最新消息，最高法已经指令广西高院再审了！
187,反正他不能活着出来，唾沫星子也给他埋了。人家个姑娘才十岁，就开始懂事卖百香果了。那个小女孩对人生是有多么大的期望，多么想努力生活，努力的活着，被这么就被迫以这么不堪方式死去。 她本应该是向阳的花阿。
188,百香果女童只有10岁啊，她的人生都还没有开始，她有什么罪，而且罪犯手段极其残忍，简直令人发指，我个人还是建议死刑，女孩的妈妈也不满意二审判决，准备申诉。
189,得，让评论区的人当法官，只要是坏人就全得判死刑。
190,看了这个视频的弹幕，我才明白，给B站某些弹幕大神普法真的没用。看了这么多期罗老师的视频，也听了这么多法律精神，这些弹幕法官还是一上来就死刑。我觉得很多人真的只是来听案子听着玩的，老师讲的完全没听进去，我也不知道这些人为什么可以边看法律解释边喊“死刑死刑”。你们先好好听听罗老师在说什么，然后再说说自己的看法不行吗？
191,最近又有一个，岳父屠了女婿一家三口，居然只判死缓，女方得到了男方家的房子和其它所有财产
192,已改判死刑，大快人心！
193,我朴素的情感一定是希望这男的死得乱七八糟，讲真
194,可能我三观不正 这种新闻看多了 我在想如果我以后有女儿的话 假设有人伤害我女儿 法律不能给予公正的处罚 我可能拼了命也要弄死那个伤害我女儿的人
195,其实完全可以看出罗老师的态度也是主张该判死刑
196,我觉得这件案子手段残忍，社会影响恶略，如果因为有自首情节就改判成功，我是有点不服
197,死缓  本来是一换n 或许会变成一换n+n
198,请各位，情绪化可以，讨论可以，但不要攻击持不同观点的对方，如学法学到没理性或网络判官之类的话
199,是罗老师给你们普法，不是弹幕法官给罗老师普法
200,看完了，感觉这个就是通过自首规避减轻刑法，建议枪毙
201,今天判完了，死刑，大家放心吧
202,罗老师，今天改判了，死刑！终于！终于！哭死我了[大哭][大哭]
203,有些人罗翔老师的视频是看了，可惜他们就光觉得自己了不起了，觉得自己冷酷无情是法律的使者，老师说的什么“不要把自己当做事后诸葛亮，要带入受害者当时”全都忘了，恨不得量你第几脚才是正当防卫(大家应该懂我说的什么)，法律是学了人性没了
204,小女孩脖子被割了一刀，在被强奸进行时被姓杨的这个男的戳瞎了双眼，后被装进蛇皮袋从山顶拖拉滚踹到山底，泡在水坑里很久，最后被就近掩埋。最让人难受的是，小姑娘不是失血过多或是外伤死亡而是血混着呕吐物堵住了气管，憋死的。 如果这还不叫情节极其恶劣，那我真的无话可说。
205,在本案中，杨某对小燕强暴并杀害。情节非常恶劣，所以一审判处死刑。二审中考虑到自首，改为死缓。但本案中仅有自首情节，并无其他减轻刑罚的条件。且此案中小燕为10岁未成年儿童，杨某进行强暴的过程中，采取的手段十分恶劣（详情见热评），个人结合法律与法理逻辑认为应该判处杨某死刑而非死缓。
206,听到谅解，第一反应是被逼的吧，各种威胁人生安全，干扰人生活，家属也没有办法这种，这种人怎么配得到谅解啊啊啊啊啊啊啊啊啊啊啊啊啊
207,从最基础的道德素质中诞生的正义，即便过于偏激，也比那些顶着理性的招牌其实只是想嘲笑贬低别人的强数百倍。如果看到丧尽天良的人渣都没有戾气，那人性也就没必要有了。
208,别说学习法律多了丧失人性，我看这个二院审我就感觉我没有人性了，直接杀了不就得了，再审个p，恶劣杀人，强奸未成年，抢劫32块零钱，虐尸这样就因为一个自首就缓期，那我把以前惹我的人全杀了是不是去自首就可以缓期，还小学生呢，没有学过法律的就不能发出自己感受么你们学法律的就很优秀？我们对这个问题感到不解难道不行？这么恶劣的事情发生在你们身上，我看你们怕不是第一想到的不是法律，而是揍那个人一顿再说把，呵呵
209,"在如此恶劣的案例中引用:一个知识越贫乏的人，越是拥有一种莫名奇怪的勇气。
人性是个好东西啊，但总有人不喜欢
“人均死刑”确实不是什么好东西，但如此恶劣且典型的故意杀人强奸等数罪并犯的案件难道不应该死刑？那么请问什么案件才需要死刑？
废死是一个大话题，西方确实废死，但国情不同，思想不同，体系不同，真的就可以直接将这种思想拿来使用？
任何权利都需要制衡，因为人并不完美，所以才会听取各方意见，多层次多方面考虑，一个只懂用条文来判决的法律人是很恐怖的，但一个不懂法只用情绪来判决的情绪人也是很恐怖的，平衡是一门艺术
提几个问题，为什么很多事情都要考虑民情，为什么要有二审多审翻案的制度，为什么有的案件地方法院已经判明，却还有最高法介入？
希望我们永远理性与人性并存(･∀･)"
210,[微笑]我只希望现在理智看待这件事的人永远不要遇上这样的事，即使遇上了也一定要冷静理智。
211,我有点好奇家属是什么心态谅解的[无语]
212,我法盲。畜生应该死刑[笑][笑]
213,死刑了!大快人心!
214,你自首想活的时候有没想过那个10岁的小女孩也想活？[呲牙]
215,二审是给罪犯辩解机会，遵循了“所有人都有申请法律援助的权利”，所以一般会和一审有冲突，我们看这个案件自然是义愤填膺，都觉得它该死，但是其他案件里被告人有可能是有冤屈的，二审就是给这样的人准备的，所以二审这个程序还是有必要的
216,"老师举的这三个例子的犯罪者最后都死刑了呀……
哪怕他们自首，哪怕他们获得了家属的原谅，哪怕他们认罪态度十分良好，最后还是死刑立即执行掉了。
这就是法律之上的人性的力量啊……"
217,"古代总说杀人偿命欠债还钱，脑袋掉了碗大个疤，二十年后又是一条好汉。
现在都不用掉脑袋了哦，二十五年后又是一条好汉（人渣）。"
218,看罗老师也就图一乐，真要学法律还得看弹幕
219,感觉有些弹幕真的不是很理智，建议先关掉看一遍比较好[微笑]
220,"罗翔老师是中国政法大学的教授，那些质疑和喷人的都是哪路神仙？法律有自己的流程，你认为怎么判就该怎么判？怎么全世界不围着你转呢？真就把法律当相声看？
刷梗的注意分地方，在这里刷梗是对办案人员和逝者的不尊重，严肃事情不需要幽默"
221,老师能说说，岳父杀女婿一家三口的事吗？
222,u1s1这些“理中客”不知道是真机器还是假虚伪，反正给👴恶心吐了🤮
223,看完了这期弹幕感觉罗老师的路还很长
224,话说有强奸犯杀完人不自首的吗？自己的“痕迹”都展露无疑了，被抓到不是早晚的事吗？等脑子清醒了，在穷凶极恶的人也会腆着脸去自首吧？？
225,"可能有些人不理解为什么二审法院要判死缓而不是立即执行，其实理由已经给出来了，法院考虑到自首情节，改判死缓
法院的判决，不仅仅只看到了犯人犯罪的一面，同时还维护了法律规定的自首制度，犯人罪大恶极，该不该杀，该杀，但犯人有自首，为了维护自首制度的存在和权威，不能对其视而不见，这是可以保证自首制度存续并能继续被人们认可信任的操作。
我说这些，不是为了让各位成为什么表面理智实则冷血的人，保持对犯罪行为的愤慨是一件非常好的事情，而是希望各位不要看不到法院的考虑，就被人带了节奏，四处宣扬有黑幕或者辱骂法院法官"
226,罗翔老师节目里说过，有的人学法学的没有人性了，应当以普通人标准而不应以理性人标准来看，二审法官估计就是这样，只看法规，理性判案，不考虑人性
227,"一个真实的事情。
我老家那边有地方拆迁，全是平房，水塘，碎石块，一个被奶奶带大的3年级的女孩自己在池塘边钓虾子，这时候一个三十多岁的男的把她推下了水塘，水塘很浅，女孩的衣服湿了，但是没有溺水，男人就哄骗她：奶奶看见你身上湿了会骂你。我带你去换衣服。女孩就和他去了那个偏僻的小屋。
后面的事诸位应该就明白了，她被活活弄死了。警察到时在屋后地下发现了女孩的尸体
这个男的，在十七岁时他也这样祸害了另一个小女孩的命，只是没有成年，再加上我老家镇长是个贪官，靠着关系，做了十几年的牢，他是在出牢两个月内又一个鲜活的生命在他的胯下没有的。
愿逝者安息"
228,这个案件而言死刑是肯定的了。希望的是大家有不同意见可以，但请不要动不动就给人贴标签。说什么中国司法系统怎么差，什么什么派。首先可以说大部分西方国家已经废除死刑了，其次对死刑的限制也是为了避免发生可能的公权力的对死刑的滥用。对于不能理解无法做到以命抵命的我觉得可以耐心多学学法律背后的哲学和观念的差异。望人们期盼的是法治而不是青天大老爷。
229,我也希望他判死刑，但是我希望他被名正言顺的判处死刑
230,在讲刑法的课堂里刷“凌迟”这类弹幕合适吗？
231,我想知道二审究竟是考虑了哪些方面最终得出死缓这个结论的？因为即使是二审的法官，也不可能闭着眼睛去判，所以我想知道对这种罪行判死缓，对社会价值导向有什么积极作用吗？是为了让更多的罪犯能够去自首，而不是去逃逸吗（因为在偏远地区出现这种命案，如果罪犯逃逸我觉得很可能很难抓到）？还是说有哪些我考虑不到的地方？
232,大家还记得是今日说法那个，消失的夫妻的那几个凶手，那是真的畜牲，说畜牲都是抬举他们了
233,也许，人类和邪恶的关系，就是大洋与漂浮在其上的冰山的关系，它们其实是同一种物质组成的巨大水体，冰山之所以被醒目地认出来，只是由于其形态不同而已，而它实质上只不过是这整个巨大水体中极小的一部分……人类是做不到道德自觉的，就像他们不可能拔着自己的头发离开大地。
234,已经死刑了
235,谁也没有资格替死去的人原谅。
236,2018年10月，灵山县10岁女童杨某燕在卖百香果回家途中，被同村男子杨光毅强奸后死亡。勤快懂事的女童无辜惨死，凶手手段还极其残忍，此案一度引发众多关注。近日，凶手杨光毅二审由死刑改判为死缓，但今天上午，情况似乎又有了变化，最高人民法院在官网上发布消息，决定对杨光毅强奸案调卷审查。[doge]
237,有些人是没情商吗？都没学过语文的，看到谅解就是认为新华字典上那个谅解？
238,"支持死刑立即执行[笑]
这是一个普通百姓处于道德和正义的想法。
评论区里某些学法的人还自己挺有优越感的一个劲指责不懂法的人真是呵呵[笑]"
239,我也是广西的呜呜，心疼这个妹妹！怎么还不杀凶手
240,老师，想问一下你最近的成都岳父灭门案什么看法？！
241,四川灭门案过来的
242,"执行死刑了！！
希望小姑娘能瞑目了！"
243,广西高院经再审认为，杨光毅犯罪手段极其残忍，情节极其恶劣，社会影响极大，罪行极其严重。杨光毅虽有自首情节，但结合其犯罪的事实、犯罪的性质、情节及对于社会的危害程度，依法对其不予从轻处罚，对该案作出上述改判。
244,其实影响很恶劣，受害人年仅10岁，受害人是先被刺伤双眼和喉咙，再被强暴，然后被淹死，最后抛在野外，而且钱全被抢走，这是故意杀人、盗劫和强暴行为，不明白为什么要判死缓两年，凶手明显是反社会人格
245,就算死刑了，罪犯也只是没什么痛苦就死了，可怜的姑娘只有十岁，是在折磨与绝望中死去的，她该有多疼多害怕啊
246,是否原谅他是神的麻烦，我们需要做的尽量快一点送他去见神
247,我不明白为什么让一个人渣死去那么难，少一张嘴少点儿贫困人口不好吗？
248,居然有弹幕说再给一次机会？？？无论是抢劫偷窃。商业诈骗。甚至说车祸误杀什么的。都可以给个机会。服刑之后重新做人。因为世界并非非黑即白。可是这么一个情况恶劣的事。居然要给个机会？？我没坐过牢但是多少了解一些。强奸幼女在监狱里都是最北看不起的。何况是奸杀。这种人就应该死刑
249,怎么还有说人生有多少个20年的？女孩的人生谁还？
250,"我不理解为什么改死缓，因为自首？是不是代表我去杀个人，然后立刻报警自首，就可以蹲几年就被放出来？
我看了一条评论，说十几年后，这个强奸杀人犯可能在大街上，与我们自己，我们的子女，我们的父母家人擦肩而过，你们不害怕吗？我怕！我不理解这种人渣为什么可以减刑
各位这是个强奸杀人犯啊！不是强奸犯！恶意杀人啊！不是过失！你会随随便便把别人套在袋子里扔到河里吗？还拿走了那32块钱！这种人挑战刑法，挑战宪法的人，怎么配活着？
我看了另外一条评论，如果被害人家属接受死缓，可以得到赔偿金，这对于这个贫穷的家庭还算有所作用，可是！花钱买一个10岁孩子的命！这值得吗？这样的现实各位不觉得可怕吗？难道所谓的生命高于一切就是一句废话？
还有很多给这个强奸杀人犯说话的，说什么应该给他公平公正，还有说什么法律是宽容不是一定要人死，还有说什么尊重人权的，可笑不可笑，那孩子的人权你们考虑过吗？这罪犯已经不是个人了啊！"
251,好家伙，评论区里有的人“人民无脑”都蹦出来了，这是直接把国家主人也一块黑啊，就算再怎么烦，一个人也不必更不能说出这句话吧？“人民无脑”都能出现在这种人的观念里，真以为今年还是1912？
252,"首先所有强奸罪都是严重的暴力犯罪，但强奸10岁女童的行为相比强奸成年女子更令人难以接受的关键在于，10岁的女童不具备第二性征，没有一般人认识上的性吸引力，对一个10岁女童的侵犯体现了犯罪者心理的极度扭曲。我是学社会学的，对法律算是门外汉，就我朴素的价值观而言，这种情节的性质的确非常恶劣，我个人支持死刑立即执行。
看了这个案件我最不理解的一点是人为什么可以为了追逐变态的快感而毫不考虑后果地犯罪，人之所以为人，其中很重要的一点是拥有理性，人可以在很大程度上控制自己的思想和行为，使其在道德和法律的约束内；我不觉得这个人具备这样的能力，不确定倘若他逃过了死刑，在服刑期间能否真的做到“洗心革面，重新做人”。"
253,"我发现你们讨论的东西都离这件事好远，有的人竟然在说其他案子……其实这个案子的事情，罗老师已经说得很明显了。跟云法官什么的也不相关，人家罗老师预测的是司法机关的判决，当然，既然是预测，也不敢说百分百准确。如果你们理解错了，不要回来骂罗老师，更不要骂我！
当然，你们既然想聊的话，我就说一句，很多人骂云法官，其实这一次，云法官的判断还真没有太大原则上的问题，但是很多人一听到有人喊死刑，下意识就会反对，其实也不过是一种印象病。
比较常见的一种论调是：不学法的人，别瞎说！
但你们怎么知道我没有做任何功课，没了解过专业知识？
就算我真的不了解法律，那你细品。
“你不会写程序，所以和程序有关的事你别参合！”这句话道理上说得通。
但如果类推一下：“你没学过法律，所以和法律有关的事你别参合！”
你们真的觉得还说得通吗？如果真的这样实行了，后果是什么？
为啥我们要普法呢？
凡事怕琢磨！"
254,还有人同意废除死刑的 我真不知道它们是怎么想的  感情死的不是自己家人就能说风凉话了？就该让这种人碰到杀人犯试试  我看你还能说出来不
255,"那些能接受死缓的理智人，假如被害人是你的孩子，你还能说出这种话，我再承认你的观点。
当它对一个十岁的孩子出手的时候，撒旦也不会原谅它。"
256,罗老师一通也讲下来了，差不多也是支持死刑了，看法律条文和实际条件确实也可以判处死刑了，那这个死刑是没问题的，法律并没有无视人性，视频都说了，行径极为恶劣的情况下是没办法减刑的，最高法也不是傻子，这个时候确该判处死刑，而不是上来就直接死刑，是要经过缜密的分析该不该死刑的，云法官显然跳过了这一步，该死和判死刑不一样
257,这期弹幕很多人在打问号，觉得判刑太轻，我觉得这正像罗老师在课上说过的，刑法是一把双刃剑，在打击犯罪的同时也限制了司法机关的权力。大家打问号的案件在我们朴素的情感来看都应该死刑立即执行甚至千刀万剐，但是反过来想如果权力不加以限制，肯定会导致权力的滥用。所以请大家相信法律专业人士的判断，就像其中的几个死缓改判死刑的案件，罪犯也得到了其应有的惩罚；同时我们的刑法也在不断地修正和完善，从而更好地兼顾法律效果和社会效果。
258,记得老师讲过一句话，二战的战犯也有人为他们辩护，而且辩论很激烈，这让法律更完善，让审判更有说服力，如果觉得一个人罪大恶极罪已致死，就可以直接拉出去砍了，那以后我们每个人都有可能被扣上罪大恶极的帽子，被草草杀掉。反复的审判也反映了法律的公正与严谨，希望最终恶人能够得到应有的惩罚，
259,就这次事件，社会恶劣影响绝对是超级大，被害人甚至是10岁不是14也不是18。[无语]
260,感觉看罗老师的视频要关弹幕才行。罗老师说过法律要超过民众的偏见，弹幕里真的太多这种偏见了
261,看这评论疯狂程度，罗老师任重而道啊，记得罗老师曾在微博说过，能叫醒一个是一个，能救活一个是一个，看来现实的确如此啊[笑哭]
262,老师讲的这么好，听众却好多都上课开小差，大家要是真的对法律感兴趣的话可以去看厚大的视频啊，里面对法律的初衷，法律的作用都有很清楚详细的解释，大家就不要在这里凭着自己都'一腔热血'在这里高呼什么'这还不死！'了，法律有法律的尊严，有法律的意义，不是你凭着一时怒气上来了就这个也死刑立即执行那个也死刑立即执行的（虽然有的我也觉得有立即执行的必要，但是既然有法院这么判了，我觉得我们要做的是理解为什么它要这么判，然后你觉得应该怎么判，你为什么这么觉得，你的依据是什么，这个依据在法律上立不立的稳，而不是'啊～情节这么恶劣，这人必死！为什么？因为他都这么恶劣的情节了，他难道还不死吗？'这种意气用事）
263,什么叫既要符合一般民众的道德又要超越一般民众的偏见？我觉得很多弹幕就是一般民众的偏见。
264,现在评论真的是让人无语，别人科普吧你说别人带着优越感，别人发表意见吧你说人家麻木不仁，你说你到底要怎么样呢？这是一个学习视频啊，遇到不会的知识和东西你首先要学习和理解啊，这也是老师科普的原因啊，就是要增强大家的法律意识啊。怎么能因为讨论的语气不好听，说的话不爱听就直接开始喷呢？这个视频的焦点不应该是老师讲的知识吗？什么时候评论区变成泄愤和喷人的地方了？这样老师会伤心的，还望大家理性讨论，有一点知识的同学说话语气客气点，不舒服的人不要太玻璃心（你和同学讨论还可能吵起来呢，这就上升了？）
265,如果见义勇为的代价就是子女受到这种侵害结果凶手还不会得到应有的惩罚的话，以后还见义勇为个屁
266,我相信强奸犯进监狱被其它狱友殴打，狱警也会睁一只眼闭一只眼，然后就拉去治疗再送回来陆陆续续反反复复[OK]（当然只是我个人的想法[生气]）
267,"该死刑就死刑，缓什么缓。
[热词系列_张三][热词系列_张三]"
268,就算那个人立功了，判了25年有期徒刑，但是那个十岁的小女孩却一年也没有了，这种人难道不该死吗？
269,罗老师看一下最近的岳父灭门案吧！
270,最后终于判了死刑！！
271,根据人民网发布的消息，改为执行死刑了！
272,最新的，这货已经死定了
273,死刑了，大快人心
274,"https://www.bilibili.com/read/cv9033558

大快人心！！！"
275,改判了，死刑立即执行！
276,"审判长：钟自彬
审判员：雷   胜
审判员：纪   娜"
277,还有国内“云南版素媛” 郭玉驰 性侵4岁幼女，至其下体破裂，被判处8年。如今已减刑2年零8个月提前出狱，却无人报道，视而不见。  @罗翔说刑法
278,有没有人是从观察者过来的
279,"自首减刑:
鼓励逃犯自首（✓）
鼓励犯罪（✓）"
280,某些情况下，我就很赞同外国那些判几十万年的，减刑八辈子都减不完那种
281,弹幕怎么这么恶臭，有没有了解过那个女孩的家庭，五个孩子，没有父亲，什么叫给的太多了，有没有考虑过，女孩原生家庭的情况。
282,"1。捅伤眼睛 颈部。 
2. 被害人10岁 儿童少年都不算。
3.强奸 
4.抛尸
5。家属不谅解
6.被害人父亲是见义勇为活雷锋，值得传播弘扬的正能量
7.犯罪动机极其卑劣、手段极其残忍、情节极其恶劣、后果极其严重，社会影响很大。
个人觉得自首情节 不足以抵销上面任何一条
死刑，没得跑了 。"
283,个人认为如果这都不是死刑立即执行  那么张扣扣案是不是判的太重？  不应该给这个为母报仇的年轻人一个机会？[怪我咯]
284,好奇怪，不管晾不谅解赔偿不都是应该的吗？怎么你们说的好像不谅解了就不用赔偿了？开车不小心撞了人都得赔人家医药费，故意qj，虐杀未成年反而不用了？要赔偿多大一笔数目才抵得上一条人命？如果施害方赔得起，他还用得着抢受害者那32块钱？如果他赔不起，你们凭什么觉得就可以通过谅解来拿到额外的赔偿？他连原本的赔偿数目都给不起！那你们的说法岂不是很可笑！
